question,votes,tags
Change tab bar item selected color in a storyboard,188,"ios, xcode, xcode6, uitabbar, uitabbaritem"
UICollectionView spacing margins,188,"ios, uicollectionview, uikit"
How can I load storyboard programmatically from class?,188,"ios, objective-c, xcode, storyboard, xib"
FBSOpenApplicationErrorDomain code =4 error,188,"ios, xcode, xcode6, ios-simulator, iphone-6"
"UIImage: Resize, then Crop",188,"iphone, ios, image-processing, core-graphics"
What's a redirect URI? how does it apply to iOS app for OAuth2.0?,188,"ios, authentication, uri, oauth-2.0"
Base64 Decoding in iOS 7+,187,"ios, objective-c, swift, ios7, ios8"
How do I open phone settings when a button is clicked?,186,"ios, swift, settings"
Creating a UICollectionView programmatically,186,"ios, objective-c, cocoa-touch, uicollectionview"
What is the right way to check for a null string in Objective-C?,186,"ios, objective-c, cocoa-touch"
Draw a perfect circle from user's touch,186,"ios, cocoa-touch, core-graphics, shape-recognition"
iOS: Modal ViewController with transparent background,185,"ios, objective-c, modalviewcontroller, presentmodalviewcontroller"
How can I change the color of pagination dots of UIPageControl?,185,"iphone, ios, uipagecontrol"
How do you dismiss the keyboard when editing a UITextField,185,"ios, iphone, cocoa-touch, uitextfield, uikeyboard"
How can I click a button behind a transparent UIView?,185,"ios, objective-c, iphone, cocoa-touch, ipad"
Xcode 4: create IPA file instead of .xcarchive,185,"ios, xcode, xcode4"
Library? Static? Dynamic? Or Framework? Project inside another project,185,"ios, xcode, frameworks, static-libraries"
Background image jumps when address bar hides iOS/Android/Mobile Chrome,185,"android, html, ios, css, twitter-bootstrap-3"
Failed to find or create execution context for description <IBCocoaTouchPlatformToolDescription: 0x7fa8bad9a6f0>,184,"c#, ios, visual-studio, xamarin"
"NavigationBar bar, tint, and title text color in iOS 8",184,"ios, swift, ios8, uinavigationbar"
Build not visible in itunes connect,184,"ios, xcode, app-store-connect"
Warning :-Presenting view controllers on detached view controllers is discouraged,184,"ios, iphone, ios7, warnings"
Class has no initializers Swift,184,"ios, uitableview, swift"
Handling applicationDidBecomeActive - “How can a view controller respond to the app becoming Active?”,184,"ios, iphone, ios4, multitasking, uiapplicationdelegate"
UISplitViewController in portrait on iPhone shows detail VC instead of master,184,"ios, interface-builder, ios8, uisplitviewcontroller, master-detail"
Programmatically add custom event in the iPhone Calendar,184,"ios, iphone, calendar, eventkit"
Is [UIScreen mainScreen].bounds.size becoming orientation-dependent in iOS8?,184,"ios, ios8, orientation, uiinterfaceorientation, uiscreen"
The model used to open the store is incompatible with the one used to create the store,183,"ios, iphone, core-data"
UIGestureRecognizer on UIImageView,183,"ios, objective-c, uiimageview, uigesturerecognizer"
Adding the “Clear” Button to an iPhone UITextField,183,"ios, cocoa-touch, uitextfield, uikit"
CGContextDrawImage draws image upside down when passed UIImage.CGImage,183,"ios, cocoa-touch, core-graphics, cgcontextdrawimage"
How to Rotate a UIImage 90 degrees?,182,"ios, objective-c, uiimage, uikit, core-graphics"
Storyboard doesn't contain a view controller with identifier,182,"ios, objective-c, xcode, storyboard"
Current location permission dialog disappears too quickly,181,"objective-c, ios, core-location"
"Xcode 8 - IB Designables - Failed to render and update auto layout status, The agent crashed",181,"ios, xcode8, xcode-storyboard"
Is there any way to see the file system on the iOS simulator?,181,"iphone, ios, nsfilemanager"
How do I correctly detect orientation change using Phonegap on iOS?,181,"javascript, iphone, ios, cordova, jqtouch"
Setting action for back button in navigation controller,180,"ios, iphone, cocoa-touch, uinavigationcontroller, uibarbuttonitem"
Validation Error: Invalid Bundle. The bundle at … contains disallowed file 'Frameworks',180,"ios, xcode, app-store-connect"
Add views in UIStackView programmatically,180,"ios, objective-c, ios9, uistackview"
Pull to refresh UITableView without UITableViewController,180,"ios, objective-c, iphone, uitableview, pull-to-refresh"
Detect if the app was launched/opened from a push notification,180,"ios, push-notification, ios6, apple-push-notifications, uiapplicationdelegate"
Having a UITextField in a UITableViewCell,180,"ios, objective-c, uitableview, cocoa-touch, uitextfield"
What's the best practice for naming Swift files that add extensions to existing objects?,180,"ios, objective-c, swift, xcode"
What is the difference between Modal and Push segue in Storyboards?,180,"ios, objective-c, swift, storyboard"
Get UIScrollView to scroll to the top,179,"ios, objective-c, iphone, uiscrollview, uikit"
"In absence of preprocessor macros, is there a way to define practical scheme specific flags at project level in Xcode project",179,"ios, swift"
UIButton title text color,179,"ios, objective-c, iphone, uibutton, textcolor"
Moving Files into a Real Folder in Xcode,179,"xcode, macos, ios, directory"
How to play video with AVPlayerViewController (AVKit) in Swift,178,"ios, swift, avfoundation, avplayerviewcontroller, avkit"
Programmatically change UITextField Keyboard type,178,"iphone, ios, uitextfield, uikeyboard"
Best practice? - Array/Dictionary as a Core Data Entity Attribute [closed],178,"objective-c, ios, core-data, nsarray, nsdictionary"
Cannot generate iOS App archive in xcode,177,"iphone, ios, xcode, macos"
ViewDidAppear is not called when opening app from background,177,"ios, objective-c, iphone, xcode, swift"
How to create border in UIButton?,177,"ios, objective-c"
UITableViewCell subview disappears when cell is selected,177,"iphone, ios, uitableview"
How can I use Autolayout to set constraints on my UIScrollview?,177,"ios, uiscrollview, storyboard, autolayout"
Pod install displaying error in cocoapods version 1.0.0.beta.1,176,"ios, cocoapods"
Get size of a View in React Native,176,"ios, react-native"
How to manually deprecate members,176,"ios, objective-c, swift, c-preprocessor, deprecated"
Why are Objective-C delegates usually given the property assign instead of retain?,176,"objective-c, ios, cocoa, delegates"
Perform Segue programmatically and pass parameters to the destination view,176,"ios, view, parameters, storyboard, segue"
How to adjust an UIButton's imageSize?,175,"ios, objective-c, xcode, uibutton"
Xcode 12.3 beta: Failed to prepare device for development,175,"ios, iphone, xcode, beta, xcode12"
Remove empty space before cells in UITableView,175,"ios, objective-c, uitableview, ios7"
Multiline label in UIStackView,175,"ios, uikit, uilabel, xcode7, uistackview"
The identity used to sign the executable is no longer valid,175,"ios, xcode, ipad, xcode4"
Rearranging Tab Bar Controller Order in StoryBoard,174,"ios, xcode"
Error message '_BSMachError: (os/kern) invalid capability (20)',174,"ios, objective-c, xcode7"
Create space at the beginning of a UITextField,173,"ios, swift, cocoa-touch, uitextfield"
Xcode 9 error: “iPhone has denied the launch request”,173,"ios, xcode, launching-application"
iOS 7 UIBarButton back button arrow color,173,"ios, ios7"
UIView Hide/Show with animation,173,"ios, objective-c, uiviewanimation"
How do I inspect the view hierarchy in iOS?,173,"ios, cocoa-touch, uikit"
Archive button grayed out in Xcode,173,"ios, xcode, ios-simulator, xcode10, xcode-scheme"
"Xcode debugger doesn't print objects and shows nil, when they aren't",173,"ios, objective-c, xcode, debugging"
NSPhotoLibraryUsageDescription key must be present in Info.plist to use camera roll,172,"ios, react-native, info.plist"
Super slow lag/delay on initial keyboard animation of UITextField,172,"objective-c, ios, cocoa-touch, keyboard, uitextfield"
convert UIImage to NSData,172,"objective-c, ios, ipad, cocoa-touch, nsdata"
How to style UITextview to like Rounded Rect text field?,172,"ios, uitextview"
Could not launch process launch failed: timed out waiting for app to launch,172,"ios, iphone, xcode, xcode5"
Disable the interactive dismissal of presented view controller,172,"ios, uiviewcontroller, uikit, modalviewcontroller, ios13"
How do I implement an Objective-C singleton that is compatible with ARC?,172,"objective-c, ios, singleton, automatic-ref-counting"
warning: 'characters' is deprecated: Please use String or Substring directly,172,"ios, string, substring, swift4, xcode9.1"
How do I detect that an iOS app is running on a jailbroken phone?,172,"ios, iphone, jailbreak"
Launch an app from within another (iPhone),172,"ios, iphone, deep-linking, openurl"
Silent pushes not delivered to the app on iOS 11,172,"ios, push-notification, ios11"
"Achieving bright, vivid colors for an iOS 7 translucent UINavigationBar",172,"ios, objective-c, uikit, uinavigationbar, ios7"
UITextView that expands to text using auto layout,171,"ios, uitextview, autolayout, nslayoutconstraint"
How can I convert my device token (NSData) into an NSString?,171,"ios, objective-c, apple-push-notifications, nsstring, nsdata"
How to change the background color of UIStackView?,171,"ios, swift, uistackview"
Xcode 9 GM - WKWebView NSCoding support was broken in previous versions,171,"ios, xcode, wkwebview, nscoding"
iphone Core Data Unresolved error while saving,170,"iphone, objective-c, ios, core-data"
Certificate has either expired or has been revoked,170,"ios, iphone, xcode"
When to use dequeueReusableCellWithIdentifier vs dequeueReusableCellWithIdentifier : forIndexPath,170,"ios, objective-c, swift"
What is the best way to deal with the NSDateFormatter locale “feechur”?,170,"ios, objective-c, iphone, locale, nsdateformatter"
How to embed small icon in UILabel,169,"ios, objective-c, cocoa-touch, ios7, textkit"
Label under image in UIButton,169,"ios, image, text, uibutton, label"
How to create an empty array in Swift?,169,"ios, arrays, swift"
Swift 3 URLSession.shared() Ambiguous reference to member 'dataTask(with:completionHandler:) error (bug),169,"ios, json, swift3"
"Xcode 5.1 - No architectures to compile for (ONLY_ACTIVE_ARCH=YES, active arch=x86_64, VALID_ARCHS=i386)",169,"ios, xcode, xcode5.1"
MongoDB vs Firebase [closed],169,"ios, mongodb, firebase, firebase-realtime-database, mongodb-query"
iPad Safari scrolling causes HTML elements to disappear and reappear with a delay,169,"css, ios, ipad, html, mobile-safari"
Error Appstore connect : Missing Purpose String in Info.plist File,169,"ios, app-store, expo, appstore-approval, info.plist"
Adding iOS UITableView HeaderView (not section header),168,"iphone, ios, uitableview"
"Swift 2: Call can throw, but it is not marked with 'try' and the error is not handled",168,"ios, xcode, swift"
NSCameraUsageDescription in iOS 10.0 runtime crash?,167,"ios, camera, plist, barcode, ios-permissions"
AutoLayout with hidden UIViews?,167,"ios, objective-c, autolayout"
How to load local html file into UIWebView,167,"ios, objective-c, iphone, cocoa-touch, uiwebview"
"UITableView, Separator color where to set?",167,"ios, objective-c, uitableview, cocoa-touch"
What is the default height of UITableViewCell?,167,"ios, iphone, uitableview"
Is it possible to Turn page programmatically in UIPageViewController?,167,"ios, ios5, uikit, uipageviewcontroller"
What's the UIScrollView contentInset property for?,167,"ios, objective-c, uiscrollview"
NSInvalidUnarchiveOperationException: Could not instantiate class named NSLayoutConstraint,166,"objective-c, ios, autolayout"
How can I delay a method call for 1 second?,166,"ios, objective-c, iphone, cocoa-touch, uikit"
Convert Swift string to array,166,"ios, arrays, swift, string"
Swift 3.0 Result of call is unused [duplicate],166,"ios, swift, swift3"
ERROR: Error installing cocoapods: ERROR: Failed to build gem native extension,166,"ios, osx-mavericks, cocoapods"
Could not instantiate class named MKMapView,166,"ios, ipad, mkmapview"
UIViewController viewDidLoad vs. viewWillAppear: What is the proper division of labor?,166,"ios, uiviewcontroller, viewdidload, viewwillappear"
"“changing property masksToBounds in transform-only layer, will have no effect” in Xcode 7",166,"ios, ios9, xcode7-beta6"
Swift - Integer conversion to Hours/Minutes/Seconds,165,"ios, swift"
Add bottom line to view in SwiftUI / Swift / Objective-C / Xamarin,165,"ios, objective-c, swift, xamarin, swiftui"
“Could not find any information for class named ViewController”,165,"ios, xcode, iboutlet"
Programmatically scroll a UIScrollView,165,"ios, objective-c, uiscrollview, scroll"
Set a default font for whole iOS app?,165,"ios, fonts"
Switching to a TabBar tab view programmatically?,165,"iphone, objective-c, ios, uitabbarcontroller"
How can I check if an app is installed from a web-page on an iPhone,165,"iphone, ios, web-applications, mobile-safari"
How can I concatenate NSAttributedStrings?,165,"ios, nsattributedstring"
Using HTML and Local Images Within UIWebView,165,"html, ios, iphone, uiwebview, uikit"
How to enable file sharing for my app?,165,"ios, file-sharing"
Dashed line border around UIView,164,"ios, objective-c, iphone, uiview"
Obscure a UITextField password,164,"ios, swift, iphone, security, ipad"
Swift startsWith method?,164,"ios, swift"
"How do I adjust the anchor point of a CALayer, when Auto Layout is being used?",164,"ios, calayer, autolayout"
How to create .ipa file using Xcode?,164,"ios, iphone, xcode, production, ips"
Async image loading from url inside a UITableView cell - image changes to wrong image while scrolling,164,"ios, objective-c, cocoa-touch, uitableview"
Custom navigation with Navigator component in React-Native,164,"javascript, ios, navigation, reactjs, react-native"
ios app maximum memory budget,163,"iphone, ios, memory, memory-management"
Fade/dissolve when changing UIImageView's image,163,"ios, objective-c, swift, cocoa-touch, uiimageview"
Adjusting the Xcode iPhone simulator scale and size [duplicate],163,"ios, xcode, ios-simulator, scale, simulator"
How to detect first time app launch on an iPhone,163,"ios, iphone, launch, launching-application"
UI Testing Failure - Neither element nor any descendant has keyboard focus on secureTextField,163,"ios, xcode, swift, ios9, xcode-ui-testing"
How to disable/enable the sleep mode programmatically in iOS?,163,ios
How can I find my Apple Developer Team id and Team Agent Apple ID?,163,ios
Proper practice for subclassing UIView?,163,"ios, objective-c, cocoa-touch, uiview"
How to save local data in a Swift app?,163,"ios, swift, nsuserdefaults"
UITapGestureRecognizer - single tap and double tap,162,"ios, iphone, uigesturerecognizer, uitapgesturerecognizer"
RealmSwift: Convert Results to Swift Array,162,"ios, swift, realm"
"Xcode playground gets stuck on 'Running playground' or 'Launching simulator' and won't run the code, what to do?",162,"ios, xcode, xcode8"
How to find NSDocumentDirectory in Swift?,162,"ios, swift, nsdocumentdirectory"
Static table view outside UITableViewController,162,"ios, iphone, xcode, cocoa-touch"
A complete solution to LOCALLY validate an in-app receipts and bundle receipts on iOS 7,162,"ios, iphone, in-app-purchase, storekit"
Distribution certificate / private key not installed,161,"ios, xcode, certificate, keychain"
How to detect orientation change?,161,"ios, swift, orientation-changes"
Centering a view in its superview using Visual Format Language,161,"ios, layout, autolayout, visual-format-language"
Navigation bar show/hide,161,"iphone, ios, uinavigationcontroller, uinavigationbar"
How to hide the “back” button in UINavigationController?,161,"ios, iphone, uinavigationcontroller"
What is the difference between a .xib file and a .storyboard?,161,"iphone, ios, ios5, xib, xcode-storyboard"
iOS app error - Can't add self as subview,161,"ios, iphone, objective-c"
UIButton: how to center an image and a text using imageEdgeInsets and titleEdgeInsets?,160,"ios, objective-c, uibutton"
Can I change multiplier property for NSLayoutConstraint?,160,"ios, iphone, objective-c, nslayoutconstraint"
Simplest way to throw an error/exception with a custom message in Swift?,160,"ios, swift"
react-native: command not found,160,"android, ios, react-native"
@IBDesignable error: IB Designables: Failed to update auto layout status: Interface Builder Cocoa Touch Tool crashed,160,"ios, swift, xcode, storyboard, interface-builder"
Xcode 4.2 - declaration of '…' will not be visible outside of this function warning,160,"iphone, ios, xcode4, ios5"
No suitable records were found verify your bundle identifier is correct,160,"ios, xcode6, app-store-connect"
"UICollectionView, full width cells, allow autolayout dynamic height?",160,"ios, uicollectionview, autolayout"
How can I convert NSDictionary to NSData and vice versa?,159,"iphone, objective-c, ios, nsdictionary"
Create UIImage with solid color in Swift,159,"ios, swift, uiimage"
Add swipe to delete UITableViewCell,159,"ios, uitableview, swift"
Programmatically open Maps app in iOS 6,159,"ios, objective-c, ios6, mapkit"
How to use NSJSONSerialization,159,"ios, objective-c, json, nsdictionary"
How can I deploy an iPhone application from Xcode to a real iPhone device?,159,"ios, xcode, deployment, certificate"
Hide the cursor of an UITextField,158,"ios, cocoa-touch, uitextfield, uipickerview"
How to determine if an NSDate is today?,158,"ios, objective-c, cocoa-touch, nsdate, nscalendar"
How do I get the current version of my iOS project in code?,158,"ios, objective-c, iphone, swift"
iOS difference between isKindOfClass and isMemberOfClass,158,"ios, objective-c, swift, class, inheritance"
What is an “unwrapped value” in Swift?,158,"ios, swift, ios8"
AndroidRuntime: FATAL EXCEPTION: androidmapsapi-ZoomTableManager,158,"android, ios, google-maps-android-api-2, google-maps-sdk-ios, google-maps-android-api-3"
Creating a UIImage from a UIColor to use as a background image for UIButton [duplicate],158,"ios, objective-c, uibutton, uiimage"
Find an object in array?,157,"ios, swift"
Xcode/Simulator: How to run older iOS version?,157,"ios, objective-c, iphone, xcode, ipad"
UILabel sizeToFit doesn't work with autolayout ios6,157,"ios, ios6, uilabel, autolayout"
set initial viewcontroller in appdelegate - swift,157,ios
CABasicAnimation resets to initial value after animation completes,157,"ios, iphone, calayer, cabasicanimation"
Move a view up only when the keyboard covers an input field,157,"ios, swift, keyboard, xcode6"
How to take a screenshot programmatically on iOS,157,"ios, iphone, screenshot"
Xcode 9 - “Fixed Width Constraints May Cause Clipping” and Other Localization Warnings,157,"ios, localization, interface-builder, xcode9-beta"
Fatal error: use of unimplemented initializer 'init(coder:)' for class,157,"ios, macos, uiviewcontroller, swift"
Module compiled with Swift 5.1 cannot be imported by the Swift 5.1.2 compiler,157,"ios, swift, xcode, swift5.1"
Error: _handleNonLaunchSpecificActions in iOS9,157,"ios, objective-c, xcode, ios9"
How to add leading padding to view added inside an UIStackView,156,"ios, swift, uiscrollview, uistackview"
Getting time elapsed in Objective-C,156,"ios, objective-c"
How to add a border just on the top side of a UIView,156,"ios, objective-c, xcode, uiview, border"
reloadData() of UITableView with Dynamic cell heights causes jumpy scrolling,156,"ios, uitableview, swift, autolayout"
How to see if an NSString starts with a certain other string?,156,"ios, objective-c, iphone, nsstring, nsmutablestring"
Convert UIImage to NSData and convert back to UIImage in Swift?,156,"ios, swift, uiimage, png, nsdata"
'Module was not compiled for testing' when using @testable,156,"ios, swift, unit-testing, swift5.4"
Outlets cannot be connected to repeating content iOS,156,"ios, storyboard"
Swift: Sort array of objects alphabetically,155,"ios, arrays, swift, sorting"
How to fix “no valid 'aps-environment' entitlement string found for application” in Xcode 4.3?,155,"ios, notifications, push-notification, apple-push-notifications"
How do I deserialize a JSON string into an NSDictionary? (For iOS 5+),155,"ios, json, ios5, nsstring, nsdictionary"
"What's the point of NSAssert, actually?",155,"ios, iphone, cocoa-touch, uikit, nsassert"
Install .ipa to iPad with or without iTunes,155,"ios, iphone, ipad, installation, ipa"
Class does not implement its superclass's required members,155,"ios, swift, sprite-kit"
Where's the difference between setObject:forKey: and setValue:forKey: in NSMutableDictionary?,155,"ios, iphone, nsmutabledictionary"
What's the best way to develop a sideswipe menu like the one in Facebook's new iOS app?,155,"objective-c, ios, cocoa-touch"
Number of days between two NSDates [duplicate],154,"ios, objective-c, cocoa-touch, nsdate"
How to make a UILabel clickable?,154,"ios, swift, uilabel, uitapgesturerecognizer"
iPhone get SSID without private library,154,"ios, iphone, xcode, ssid"
Detect permission of camera in iOS,154,"ios, permissions, camera, uiimagepickercontroller, ios-permissions"
How to Correctly handle Weak Self in Swift Blocks with Arguments,154,"ios, swift, retain-cycle"
Error “library not found for” after putting application in AdMob,153,"ios, xcode, admob, cocoapods"
How to set the full width of separator in UITableView,153,"ios, objective-c, iphone, uitableview"
Change string color with NSAttributedString?,153,"ios, cocoa-touch, nsattributedstring"
How to hide the keyboard when I press return key in a UITextField?,153,"ios, objective-c, cocoa-touch, delegates"
UILabel - Wordwrap text,153,"ios, iphone, cocoa-touch, uilabel, word-wrap"
iPhone: Detecting user inactivity/idle time since last screen touch,153,"ios, objective-c, iphone, idle-timer"
Command failed due to signal: Segmentation fault: 11,153,"ios, swift, segmentation-fault"
Why would you use an ivar?,153,"objective-c, ios, memory-management, key-value-observing, ivar"
Camera access through browser,153,"ios, html, camera"
Enabling auto layout in iOS 6 while remaining backwards compatible with iOS 5,153,"ios, ios5, backwards-compatibility, ios6, autolayout"
How to force view controller orientation in iOS 8?,152,"ios, objective-c, ios8, uinavigationcontroller, autorotate"
Xcode 7.2 no matching provisioning profiles found,152,"ios, xcode, provisioning-profile"
Objective-C - Remove last character from string,152,"ios, objective-c, string, cocoa, cocoa-touch"
how to open an URL in Swift3,152,"ios, swift, swift3"
How to disable the highlight control state of a UIButton?,152,"ios, cocoa-touch, uibutton, uikit, uicontrol"
How to detect when a UIScrollView has finished scrolling,152,"ios, iphone, uiscrollview"
Change Default Scrolling Behavior of UITableView Section Header,152,"ios, iphone, uitableview, cocoa-touch"
Safe Area of Xcode 9,152,"ios, swift, ios11, xcode9, safearealayoutguide"
Xcode: Could not locate device support files,152,"ios, xcode, ios7, xcode8, iphone-4"
What is the iBeacon Bluetooth Profile,152,"ios, bluetooth, bluetooth-lowenergy, reverse-engineering, ibeacon"
LibStatusBar icon disappears on 3rd-party app launch,152,"ios, ios7, jailbreak, cydia, libstatusbar"
Difference between UIViewContentModeScaleAspectFit and UIViewContentModeScaleToFill?,151,"ios, uiimageview, contentmode, uiviewcontentmode"
"Building for iOS Simulator, but the linked framework '****.framework' was built for iOS",151,"ios, xcode"
Event handling for iOS - how hitTest:withEvent: and pointInside:withEvent: are related?,151,"ios, uiview, uikit"
Xcode Storyboard warning: Constraint referencing items turned off in current configuration. Turn off this constraint in the current configuration,151,"ios, xcode, cocoa-touch, storyboard, xcode6"
Disabled UIButton not faded or grey,151,"ios, iphone, cocoa-touch, uibutton"
Make a VStack fill the width of the screen in SwiftUI,151,"ios, swift, xcode, swiftui"
How to remove an iOS app from the App Store,151,"ios, iphone, app-store"
Easiest way to detect Internet connection on iOS?,151,"ios, nsurlconnection, reachability, internet-connection"
How do I wrap text in a UITableViewCell without a custom cell,151,"ios, objective-c, cocoa-touch, uikit, iphone-sdk-2"
UIView bottom border?,150,"ios, uiview, border"
Delaying function in swift [duplicate],150,"ios, swift, function, delay"
Display clearColor UIViewController over UIViewController,150,"iphone, objective-c, ios, uiviewcontroller, storyboard"
How do I create a round cornered UILabel on the iPhone?,150,"ios, objective-c, cocoa-touch, uilabel, rounded-corners"
"Unable to simultaneously satisfy constraints, will attempt to recover by breaking constraint",150,"ios, objective-c, debugging, nslayoutconstraint"
The best way to remove duplicate values from NSMutableArray in Objective-C?,150,"ios, objective-c, nsmutablearray"
Types in Objective-C on iOS,150,"ios, objective-c"
How do you turn off auto-capitalisation in HTML form fields in iOS?,150,"ios, html"
What is the AppDelegate for and how do I know when to use it?,150,"ios, objective-c, cocoa-touch"
How do you get an iPhone's device name,149,"ios, uikit"
Libraries not found when using CocoaPods with iOS logic tests,149,"ios, unit-testing, cocoapods"
UINavigationController “back button” custom text?,149,"ios, iphone, uinavigationcontroller"
Can I set the cookies to be used by a WKWebView?,149,"ios, cookies, uiwebview, ios8, wkwebview"
"Given a view, how do I get its viewController?",149,"ios, iphone, debugging, uiview, uiviewcontroller"
UIPanGestureRecognizer - Only vertical or horizontal,149,"ios, uigesturerecognizer"
Why does UITableViewCell remain highlighted?,149,"ios, uitableview, cocoa-touch"
IOS: verify if a point is inside a rect,149,"ios, uiview, collision-detection, cgrect, cgpoint"
Importing Project-Swift.h into a Objective-C class…file not found,149,"ios, objective-c, xcode, swift, xcode6"
