question,votes,tags
Do I set properties to nil in dealloc when using ARC?,125,"objective-c, ios, automatic-ref-counting"
Clearing purchases from iOS in-app purchase sandbox for a test user,125,"iphone, ios, in-app-purchase"
Registering for Push Notifications in Xcode 8/Swift 3.0?,124,"ios, push-notification, swift3, ios10, unusernotificationcenter"
Adjust UIButton font size to width,124,"ios, objective-c"
How to change UIButton image in Swift,124,"ios, xcode, swift, uibutton"
Xcode MyProjectName-Bridging-Header.h does not exist,124,"ios, objective-c, xcode, swift"
Cordova app not displaying correctly on iPhone X (Simulator),124,"ios, cordova, phonegap, iphone-x"
UITableView dynamic cell heights only correct after some scrolling,124,"ios, uitableview, ios8, autolayout, ios-autolayout"
How to get my IP address programmatically on iOS/macOS?,124,"ios, macos, ip-address, ipv6"
Why do we use use_frameworks! in CocoaPods?,124,"ios, frameworks, cocoapods, static-libraries"
iOS 7.0 No code signing identities found,124,"ios, ios7, code-signing"
Disabling user selection in UIWebView,123,"ios, uiwebview, webkit, ios4, mobile-webkit"
Swift: delete all array elements,123,"ios, swift"
How to add minutes to current time in swift,123,"ios, swift, date"
Convert NSData to String?,123,"iphone, ios, sqlite, openssl, nsdata"
Migrating from UIWebView to WKWebView,123,"ios, swift, uiwebview, wkwebview"
Xcode6: Run two instances of the simulator,123,"ios, xcode, xcode6, simulator"
How can I programmatically check whether a keyboard is present in iOS app?,123,"ios, objective-c, swift, swiftui, keyboard"
How to get Core Data object from specific Object ID?,123,"ios, macos, cocoa, core-data, nsfetchrequest"
How to reduce iOS AVPlayer start delay,123,"ios, delay, avplayer"
Remove alpha channel in an image,122,"ios, image, alpha"
Error when trying to obtain a certificate: The specified item could not be found in the keychain,122,"ios, codesign"
Swift Framework: Umbrella header '[…].h' not found,122,"ios, swift, ios-frameworks"
How can I convert a String to an MD5 hash in iOS using Swift?,122,"ios, swift, md5"
Completion block for popViewController,122,"ios, cocoa-touch, uiview, uiviewcontroller, uiviewanimation"
Changing specific text's color using NSMutableAttributedString in Swift,122,"ios, swift, nsmutableattributedstring"
Is it possible to obtain a dynamic table view section header height using Auto Layout?,122,"ios, uitableview, ios8, autolayout"
Xcode 8 “the aps-environment entitlement is missing from the app's signature” on submit,122,"ios, xcode, apple-push-notifications, provisioning-profile, entitlements"
Load resources from relative path using local html in uiwebview,122,"ios, uiwebview"
How to limit UITableView row reordering to a section,122,"ios, iphone, uitableview, cocoa-touch"
How to prevent screen lock on my application with swift on iOS,122,"ios, swift, locking, screen"
“This function declaration is not a prototype” warning in Xcode 9,122,"ios, objective-c, xcode, ios11, xcode9-beta"
Collapse sequences of white space into a single character and trim string,122,"objective-c, ios, nsstring"
Storyboard - refer to ViewController in AppDelegate,122,"iphone, objective-c, ios, uiviewcontroller, storyboard"
How to use NSCache,122,"ios, objective-c, xcode, cocoa, nscache"
Cocoapods setup stuck on pod setup command on terminal,121,"ios, ruby, git, xcode5, cocoapods"
Xcode Command /usr/bin/codesign failed with exit code 1 : errSecInternalComponent,121,"ios, xcode, certificate, provisioning-profile"
iPhone UIButton - image position,121,"ios, iphone, cocoa-touch, uibutton, imageedgeinsets"
iPhone Keyboard Covers UITextField,121,"ios, iphone, keyboard, uitextfield"
UIButton custom font vertical alignment,121,"ios, objective-c, fonts, vertical-alignment"
Do something every x minutes in Swift,121,"ios, swift, setinterval, intervals, repeat"
How to pinch out in iOS simulator when map view is only a portion of the screen?,121,"ios, mkmapview, simulator"
How to create a colored 1x1 UIImage on the iPhone dynamically?,121,"ios, uiimage, core-graphics, quartz-graphics"
Completion handler for UINavigationController “pushViewController:animated”?,121,"ios, uinavigationcontroller, handler, pushviewcontroller"
How to add a Container View programmatically,121,"ios, cocoa-touch, subview, uicontainerview, childviewcontroller"
How to show the loading indicator in the top status bar,121,"ios, cocoa-touch"
How to remove the default Navigation Bar space in SwiftUI NavigationView,121,"ios, swift, swiftui-list, swiftui"
Dismissing a Presented View Controller,121,"iphone, ios, objective-c, cocoa-touch, uiviewcontroller"
Unbalanced calls to begin/end appearance transitions for <UITabBarController: 0x197870>,121,"ios, ios4, uitabbarcontroller"
"Paging UICollectionView by cells, not screen",121,"ios, objective-c, uicollectionview, uicollectionviewlayout"
In which situations do we need to write the __autoreleasing ownership qualifier under ARC?,121,"objective-c, ios, memory-management, automatic-ref-counting"
"Cannot install cocoa pods after uninstalling, results in error",120,"ios, terminal, installation, cocoapods"
iOS Universal Links are not opening in-app,120,"ios, objective-c, xcode, ios9, ios-universal-links"
How to make a simple rounded button in Storyboard?,120,"ios, xcode, uibutton, storyboard"
Could not load NIB in bundle,120,"ios, iphone, xcode, titanium, appcelerator"
How to create UILabel programmatically using Swift?,120,"ios, swift"
Do I need to disable NSLog before release Application?,120,"ios, iphone, nslog"
Setting the zoom level for a MKMapView,120,"iphone, ios, mapkit"
How to change the colors of a segment in a UISegmentedControl in iOS 13?,120,"ios, uikit, uisegmentedcontrol, ios13"
UINavigationController without navigation bar?,120,"ios, uinavigationcontroller"
Add UIPickerView & a Button in Action sheet - How?,120,"ios, iphone, uipickerview, actionsheetpicker"
How to create percentage of total width using autolayout?,120,"ios, xcode, autolayout"
What does this gdb output mean?,120,"ios, objective-c, audio, ios-simulator, playback"
Unable to fix signing identity issue on Xcode,120,"ios, xcode, developer-tools, code-signing-certificate"
The executable gets signed with invalid entitlements in Xcode,119,"ios, xcode, code-signing, provisioning-profile"
Use of undeclared identifier 'kUTTypeMovie',119,"ios, cocoa-touch, mobilecoreservices"
How to detect that animation has ended on UITableView beginUpdates/endUpdates?,119,"iphone, objective-c, ios, ipad"
How do I create a custom iOS view class and instantiate multiple copies of it (in IB)?,119,"ios, xcode, class, uiview, uiviewcontroller"
How to make a transparent UIWebView,119,"ios, iphone, cocoa-touch, uiwebview"
how to disable rotation in React Native?,119,"ios, react-native"
Adjust UILabel height to text,119,"ios, swift, height, uilabel, frame"
How to present popover properly in iOS 8,119,"ios, swift, uipopovercontroller, ios8, uipopover"
No suitable application records were found,119,"ios, ios4, app-store"
What happens with constraints when a view is removed,119,"ios, autolayout, nslayoutconstraint"
Xcode project not showing list of simulators,118,"ios, xcode, xcode6.1"
Xcode 8.3 / Xcode 9.0 Refresh provisioning profile devices,118,"ios, xcode, provisioning-profile"
How do I change the color of the text in a UIPickerView under iOS 7?,118,"ios, objective-c, uiview, ios7, uipickerview"
fatal error: malformed or corrupted AST file - Xcode,118,"ios, xcode, ios7"
How do I get an ISO 8601 date on iOS?,118,"ios, nsdate, nsdateformatter, iso8601"
What does “Receiver type 'CALayer' for instance message is a forward declaration” mean here?,118,"objective-c, ios, core-animation, calayer, automatic-ref-counting"
iOS start Background Thread,118,"objective-c, ios, multithreading, uikit, core-foundation"
best way to add license section to iOS settings bundle,118,"ios, plist, settings.bundle"
How to change UIPickerView height,118,"ios, iphone, cocoa-touch, uikit, uipickerview"
iOS 9 Xcode 7 - Application appears with black bars on top and bottom,118,"ios, ios9, xcode7"
Is it possible to determine whether ViewController is presented as Modal?,118,"iphone, ios, view, controller, modal-dialog"
In-App Purchases stuck in “Missing Metadata” state,118,"ios, in-app-purchase, app-store-connect, metadata"
Understanding NSRunLoop,118,"ios, objective-c, cocoa-touch, nsrunloop"
Xcode 9 Swift Language Version (SWIFT_VERSION),118,"ios, swift, xcode, swift3, xcode9"
How do I prevent the iPhone screen from dimming or turning off while my application is running?,118,"ios, uiapplication"
Weird uitableview behaviour in iOS11. Cells scroll up with navigation push animation,118,"ios, uitableview, animation, uinavigationcontroller"
How to create local notifications?,118,ios
No valid 'aps-environment' entitlement string found for application on app store,117,"ios, xcode, apple-push-notifications, app-store, entitlements"
How to underline a UILabel in swift?,117,"ios, swift, overriding, uilabel, nsattributedstring"
"Using `textField:shouldChangeCharactersInRange:`, how do I get the text including the current typed character?",117,"ios, objective-c, uitextfield"
Blank space at top of UITextView in iOS 10,117,"ios, iphone, xcode, cocoa-touch, uitextfield"
"Linker Command failed with exit code 1 (use -v to see invocation), Xcode 8, Swift 3",117,"ios, objective-c, xcode, xcode8, carthage"
Swift: How to get substring from start to last index of character,117,"ios, swift"
How does clipsToBounds work?,117,"ios, uiview, uikit, frame, bounds"
What's the equivalent of Java's Thread.sleep() in Objective-C/Cocoa?,117,"ios, objective-c, cocoa-touch, sleep"
UITextField auto-capitalization type - iPhone App,117,"ios, uitextfield"
iOS9 getting error “an SSL error has occurred and a secure connection to the server cannot be made”,117,"ios, ssl-certificate, app-transport-security"
NSDefaultRunLoopMode vs NSRunLoopCommonModes,117,"iphone, ios, multithreading, nsrunloop"
iPhone viewWillAppear not firing,117,"iphone, ios, cocoa-touch"
SecItemAdd and SecItemCopyMatching returns error code -34018 (errSecMissingEntitlement),117,"ios, cocoa, keychain, sskeychain"
“Unexpected Machine Code” warning from iTunes Connect,117,"ios, app-store-connect"
iOS Static vs Dynamic frameworks clarifications,117,"ios, frameworks, static-libraries, static-linking, ios-frameworks"
How to determine the content size of a UIWebView?,116,"ios, iphone, cocoa-touch, uiwebview, uikit"
UILabel with text of two different colors,116,"ios, objective-c, swift, uilabel, textcolor"
"If no Table View results, display “No Results” on screen",116,"ios, objective-c, uitableview, parse-platform"
Adding rounded corner and drop shadow to UICollectionViewCell,116,"iphone, ios, uicollectionviewcell"
Copy paste text into iOS simulator,116,"ios, clipboard"
How to add a button to UINavigationBar?,116,"ios, iphone, xcode, interface-builder, uinavigationbar"
How to get all enum values as an array,116,"ios, arrays, swift, enums"
swift convert Range<Int> to [Int],116,"ios, arrays, swift, int, range"
CALayer with transparent hole in it,116,"ios, objective-c, calayer, quartz-core"
UIActionSheet cancel button strange behaviour,116,"ios, objective-c, iphone, cocoa-touch, uiactionsheet"
iOS Equivalent For Android Shared Preferences,116,"ios, sharedpreferences"
Allowing interaction with a UIView under another UIView,116,"objective-c, ios, cocoa-touch"
Xcode without Storyboard and ARC,116,"ios, iphone, xcode, uistoryboard"
Declaration/definition of variables locations in ObjectiveC?,116,"iphone, objective-c, ios, ios5"
Invalid Swift Support - Files don’t match,116,"ios, xcode, swift"
Does Swift support reflection?,116,"ios, reflection, swift"
Xcode 6 with Swift super slow typing and autocompletion,116,"ios, xcode, autocomplete, swift, xcode6"
What's the difference between “Architectures” and “Valid Architectures” in Xcode Build Settings?,116,"ios, xcode, xcode4.5"
CredStore Perform Query error,116,"ios, xcode9"
How can I use UIColorFromRGB in Swift?,115,"ios, swift"
Swift - How to hide back button in navigation item?,115,"ios, swift"
Map array of objects to Dictionary in Swift,115,"ios, arrays, swift, dictionary"
Xcode 8 Beta - Convert to Current Swift Syntax Failed: Could not find test host,115,"ios, xcode, xcode8"
How to hide keyboard when using SwiftUI?,115,"ios, swift, keyboard, swiftui, textfield"
Adjust alpha of UIColor,115,"ios, objective-c, alpha, uicolor"
Replacement for stringByAddingPercentEscapesUsingEncoding in ios9?,115,"ios, objective-c, url, encoding, deprecated"
Aligning UIToolBar items,115,"ios, cocoa-touch, uitoolbar"
symbol(s) not found for architecture i386,115,"objective-c, ios, xcode4"
Ask for User Permission to Receive UILocalNotifications in iOS 8,115,"ios, cocoa-touch, notifications, ios8, uilocalnotification"
Can you build dynamic libraries for iOS and load them at runtime?,115,"ios, xcode, dylib"
“Auto Layout still required after executing -layoutSubviews” with UITableViewCell subclass,115,"objective-c, ios, xcode4.5, autolayout"
Specifying one Dimension of Cells in UICollectionView using Auto Layout,115,"ios, objective-c, uicollectionview, autolayout"
"AppStore - App status is ready for sale, but not in app store",115,"ios, app-store, app-store-connect"
NSAttributedString add text alignment,114,"ios, objective-c, nsattributedstring, core-text"
How to flip UIImage horizontally?,114,"ios, uiimage, uiimageorientation"
Swift add icon/image in UITextField,114,"ios, image, swift, login, uitextfield"
How do I get hour and minutes from NSDate?,114,"ios, objective-c, nsdate, hour"
How to easily resize/optimize an image size with iOS?,114,"ios, objective-c, image, cocoa-touch, resize"
Understanding ibeacon distancing,114,"ios, objective-c, bluetooth, bluetooth-lowenergy, ibeacon"
How do I scroll the UIScrollView when the keyboard appears?,114,"ios, objective-c, iphone, cocoa-touch, scrollview"
Xcode - There are no dSYMs available for download,114,"ios, xcode, xcode7, dsym"
How to open maps App programmatically with coordinates in swift?,114,"ios, swift, apple-maps"
Do remote push notifications require to add UIBackgroundModes in Info.plist?,114,"ios, info-plist, uibackgroundmode"
Duplicate Symbols for Architecture arm64,114,"ios, objective-c, xcode, linker-errors"
How to hide first section header in UITableView (grouped style),114,"ios, uitableview, ios7"
How to create P12 certificate for iOS distribution,114,"ios, iphone, xcode, certificate, p12"
How to set UICollectionViewDelegateFlowLayout?,114,"ios, uicollectionview, flowlayout"
Expand/collapse section in UITableView in iOS,114,"ios, iphone, uitableview, object"
Navigation bar appear over the views with new iOS7 SDK,114,"iphone, ios, objective-c, ipad, ios7"
Check if UIColor is dark or bright?,114,"ios, iphone, xcode, colors, uicolor"
"Using Core Data, iCloud and CloudKit for syncing and backup and how it works together",114,"ios, core-data, icloud, cloudkit"
What makes a keychain item unique (in iOS)?,114,"objective-c, ios, macos, keychain"
How to customize the background/border colors of a grouped table view cell?,114,"ios, objective-c, iphone, uitableview, cocoa-touch"
When is it better to use an NSSet over an NSArray?,113,"ios, objective-c, arrays, cocoa, cocoa-touch"
Running CocoaPods on Apple Silicon (M1),113,"ios, macos, flutter, cocoapods, apple-silicon"
NSDate beginning of day and end of day,113,"ios, nsdate, nsdatecomponents"
How do you create a UIImage View Programmatically - Swift,113,"ios, xcode, swift, uiimageview, uiimage"
Autolayout: Add constraint to superview and not Top Layout Guide?,113,"ios, storyboard, autolayout, nslayoutconstraint"
How does a UILabel's minimumScaleFactor work?,113,"ios, objective-c, uilabel"
How to save Array to CoreData?,113,"ios, arrays, swift, core-data, magicalrecord"
How do I make UILabel display outlined text?,113,"ios, objective-c, iphone, cocoa-touch, core-graphics"
Delete specified file from document directory,113,"ios, objective-c, xcode, nsdocumentdirectory"
iOS 7 parallax effect in my view controller,113,"ios, objective-c, swift, parallax"
How to re-sign the ipa file?,113,"ios, ios-provisioning, ipa"
How to check if UILabel is truncated?,113,"ios, objective-c, iphone, uilabel, truncate"
How do I save a UIImage to a file?,113,"iphone, objective-c, ios, uiimage"
What does “% is unavailable: Use truncatingRemainder instead” mean?,113,"ios, swift, swift3, modulus"
Protocol can only be used as a generic constraint because it has Self or associatedType requirements,113,"ios, swift, generics, swift2, swift-protocols"
Where are ${EXECUTABLE_NAME} and ${PRODUCT_NAME} defined,113,"iphone, objective-c, ios, xcode, plist"
Swift - which types to use? NSString or String,113,"ios, objective-c, string, macos, swift"
iOS / Android cross platform development [closed],113,"android, ios, cross-platform"
What is the difference between libsqlite3.dylib and libsqlite3.0.dylib?,113,"ios, sqlite"
iOS 7 style Blur view,113,"ios, objective-c, core-graphics"
Status bar could not find cached time string image. Rendering in-process,113,"ios, swift4.1, xcode9.3"
Xcode 6.4 The Application You Have Selected Does Not Exist,113,"ios, xcode, app-store-connect"
UINavigationBar Hide back Button Text,112,"ios, uinavigationcontroller"
Making text bold using attributed string in swift,112,"ios, swift, nsmutableattributedstring"
UICollectionView's cellForItemAtIndexPath is not being called,112,"ios, objective-c, uicollectionview"
How to get the indexpath.row when an element is activated?,112,"ios, swift, iphone, uitableview"
How do I create a multiline TextField in SwiftUI?,112,"ios, swiftui, textview, textfield"
Xcode stops working after set “xcode-select -switch”,112,"ios, xcode, macos"
How to load a xib file in a UIView,112,"ios, objective-c, uiview, xib"
Obtain bundle identifier programmatically in Swift?,112,"ios, swift, ios8, bundle-identifier"
Interface Builder: What are the UIView's Layout iOS 6/7 Deltas for?,112,"ios, layout, uiview, xcode5"
SourceKitService Consumes CPU and Grinds Xcode to a Halt,112,"ios, iphone, swift, xcode, sourcekit"
How to disable UITextField editing but still accept touch?,112,"ios, uitextfield, uipickerview"
What does the “automatically adjusts font requires using a dynamic type text style” warning mean?,112,"ios, swift, storyboard, xcode8"
Remove text from Back button keeping the icon,111,"ios, swift, xcode"
Get current URL of UIWebView,111,"ios, iphone, url, request, uiwebview"
Change color of UISwitch in “off” state,111,"iphone, ios, uiswitch"
How can I convert from degrees to radians?,111,"ios, objective-c, macos, swift, macros"
Left Align Cells in UICollectionView,111,"ios, objective-c, uicollectionview, uicollectionviewlayout"
Where to store global constants in an iOS application?,111,"ios, objective-c, cocoa-touch, constants, global"
Move TextField up when the keyboard has appeared in SwiftUI,111,"ios, swift, swiftui"
"How disable Copy, Cut, Select, Select All in UITextView",111,"ios, objective-c, uitextview"
How do I use Safe Area Layout programmatically?,111,"ios, swift, iphone-x, safearealayoutguide"
Change color of png in buttons - ios,111,"ios, swift"
UIAlertView first deprecated IOS 9,111,"ios, objective-c, uialertview, uialertcontroller"
What values should I use for CFBundleVersion and CFBundleShortVersionString?,111,ios
UIPopovercontroller dealloc reached while popover is still visible,111,"ios, memory-management, uipopovercontroller, automatic-ref-counting"
Xcode Debugger: view value of variable,111,"iphone, objective-c, xcode, debugging, ios"
No identities were available - administrator request,111,"ios, iphone, xcode, certificate"
Using a BOOL property,111,"objective-c, ios, properties"
Enterprise App Update Distribution on iOS 8,111,"ios, xcode, ios8, enterprise-distribution"
What is the best way to check if a UIAlertController is already presenting?,111,"ios, uialertcontroller"
How do I access the host machine itself from the iPhone simulator,111,"ios, iphone, ipad"
iOS app icon with transparent background showing black background on device,111,"ios, background, icons, transparency"
How to remove the Xcode warning Apple Mach-O Linker Warning 'Pointer not aligned at address,111,"ios, xcode, cocoapods, warnings"
Receiving kAUGraphErr_CannotDoInCurrentContext when calling AUGraphStart for playback,111,"ios, audiounit, audiotoolbox"
How can I color a UIImage in Swift?,110,"ios, image, swift, colors, uiimage"
how to change uiviewcontroller title independent of tabbar item title,110,"ios, cocoa-touch, uiviewcontroller, uitabbarcontroller"
How to dismiss keyboard iOS programmatically when pressing return,110,"ios, keyboard, uitextfield"
Xcode Simulator animations extremely slow when played in editor,110,"ios, xcode, ios-simulator, simulator"
"Undocumented NSURLErrorDomain error codes (-1001, -1003 and -1004) using StoreKit",110,"ios, nsurlsession, storekit, nsurlerrordomain"
Adding a simple UIAlertView,110,"ios, objective-c, iphone, cocoa-touch, uialertview"
"Create UIActionSheet 'otherButtons' by passing in array, not varlist",110,"ios, iphone, uialertview, uiactionsheet"
When can I activate/deactivate layout constraints?,110,"ios, swift, uiview, autolayout, nslayoutconstraint"
UITableView with fixed section headers,110,"ios, objective-c, uitableview"
Long press gesture on UICollectionViewCell,110,"ios, objective-c, uicollectionview"
How do I get the day of the week with Foundation?,110,"ios, objective-c, cocoa-touch, nsdate"
How can I get a view's current width and height when using autolayout constraints?,110,"ios, autolayout"
iOS 7 TextKit - How to insert images inline with text?,110,"ios, ios7, textkit"
React Native Responsive Font Size,110,"ios, reactjs, react-native"
Visual List of iOS Fonts?,110,"ios, uifont, typeface"
Changing UIImage color,109,"iphone, objective-c, ios, uiimage, cgcontext"
UICollectionView auto scroll to cell at IndexPath,109,"ios, uicollectionview"
Get position of UIView in respect to its superview's superview,109,"iphone, ios, uiview, uibutton, cgrect"
error: module file's minimum deployment target is ios8.3 v8.3,109,"ios, xcode, swift, xcode6, swift-playground"
iOS 5 Best Practice (Release/retain?),109,"iphone, ios, ios5, memory-management, automatic-ref-counting"
iOS 7 - Status bar overlaps the view,109,"ios, statusbar, ios7"
Programmatically Request Access to Contacts,109,"iphone, objective-c, ios, ios6, contacts"
Development team not showing in Xcode,109,"ios, certificate, app-store-connect, provisioning-profile"
Hidden Features of Xcode 4,109,"cocoa, ios, macos, xcode4, hidden-features"
How do iOS Push Notifications work?,109,"ios, push-notification, apple-push-notifications"
Get notified when UITableView has finished asking for data?,109,"ios, iphone, uitableview"
UIButton won't go to Aspect Fit in iPhone,108,"ios, iphone, uibutton, aspect-fit"
Remove HTML Tags from an NSString on the iPhone,108,"ios, objective-c, iphone, cocoa-touch, nsstring"
What's the best way to add a drop shadow to my UIView,108,"ios, uiview, shadow, cliptobounds"
Swift - How to detect orientation changes,108,"ios, swift"
UIView touch event in controller,108,"ios, swift, uiview, uiviewcontroller"
iOS: Access app-info.plist variables in code,108,"iphone, objective-c, ios, ipad, info.plist"
How can I get the font size and font name of a UILabel?,108,ios
How to make return key on iPhone make keyboard disappear?,108,"ios, iphone, uitextfield, uikeyboard"
change text of button and disable button in iOS,108,"ios, button, text"
How to set the width of a cell in a UITableView in grouped style,108,"ios, iphone, uitableview, width"
How to obtain Certificate Signing Request,108,"ios, xcode, certificate, keychain, certificate-signing-request"
WKWebView equivalent for UIWebView's scalesPageToFit,108,"ios, wkwebview"
AVAudioPlayer throws breakpoint in debug mode,108,"ios, objective-c, iphone, cocoa-touch, avaudioplayer"
iOS Launch screen in React Native,108,"ios, xcode, react-native, asset-catalog"
Can I install the “app store” in an IOS simulator?,108,"ios, app-store, simulator"
Behaviour for significant change location API when terminated/suspended?,108,"ios, core-location, cllocationmanager, uiapplicationdelegate, ios-app-suspended-state"
Bundle ID Suffix? What is it?,108,"iphone, cocoa-touch, app-store-connect, ios"
How does View Controller Containment work in iOS 5?,108,"ios, uiviewcontroller, ios5"
"Xcode 10b5 - duplicate symbol linker error, can't compile with Crashlytics",108,"ios, xcode, crashlytics, google-fabric, xcode10"
Check play state of AVPlayer,107,"ios, objective-c, iphone, avfoundation, avplayer"
iPhone : How to detect the end of slider drag?,107,"ios, iphone, ios5, ios4, uislider"
UICollectionView Set number of columns,107,"ios, objective-c, xcode, uicollectionview, uicollectionviewcell"
Use Storyboard to mask UIView and give rounded corners?,107,"ios, xcode, swift, storyboard, autolayout"
“From View Controller” disappears using UIViewControllerContextTransitioning,107,"ios, iphone, objective-c, uiview, transition"
Getting the Value of a UITextField as keystrokes are entered?,107,"ios, objective-c, cocoa-touch, uitextfield"
Can we open pdf file using UIWebView on iOS?,107,"ios, pdf, uiwebview"
What is the “right” way to handle orientation changes in iOS 8?,107,"ios, ios8, orientation, uiinterfaceorientation, landscape-portrait"
iOS Detect 3G or WiFi,107,"ios, objective-c, wifi, reachability, 3g"
How do you add an action to a button programmatically in xcode,107,"ios, iphone, objective-c, uibutton, programmatically-created"
Check for internet connection availability in Swift,107,"ios, swift, network-connection"
iOS - How to set a UISwitch programmatically,107,"objective-c, ios"
