question,votes,tags
Getting row of UITableView cell on button press,84,"objective-c, ios, uitableview"
Resize UIImage to 200x200pt/px,84,"ios, swift, uiimage"
Custom UITableViewCell selection style?,84,"ios, objective-c, uitableview, click, selection"
How to animate the textColor property of an UILabel?,84,"ios, swift, core-animation"
UICollectionView animate data change,84,"ios, uicollectionview"
Сocoapods trunk URL couldn't be downloaded,84,"ios, iphone, cocoapods, podfile, pod-update"
"How to Edit Empty Spaces of Left, Right UIBarButtonItem in UINavigationBar [iOS 7]",84,"ios, iphone, ios7, uinavigationbar, uibarbuttonitem"
How to set the opacity/alpha of a UIImage?,84,"ios, uiimageview, uiimage, opacity, alpha"
SwiftUI update navigation bar title color,84,"ios, navigationbar, swiftui"
Generate a random float between 0 and 1,84,"ios, c, random, floating-point, arc4random"
Remove println() for release version iOS Swift,84,"ios, xcode, swift, xcode6"
Hide remove separator line if UITableViewCells are empty [duplicate],84,"ios, uitableview, cocoa-touch"
Getting device orientation in Swift,84,"ios, swift, orientation"
NSIndexpath.item vs NSIndexpath.row,84,"ios, uitableview, nsindexpath"
UIApplication.registerForRemoteNotifications() must be called from main thread only,84,"ios, swift, push-notification, swift4, unusernotificationcenter"
"Xcode 4: Creating a UIView xib, not properly connecting",84,"ios, xcode, xcode4"
Append data to a POST NSURLRequest,84,"ios, objective-c, nsurlrequest"
iOS SwiftUI: pop or dismiss view programmatically,84,"ios, swift, swiftui"
How to convert this var string to URL in Swift,84,"ios, swift, nsurl"
Core Data background context best practice,84,"ios, objective-c, core-data, nsmanagedobjectcontext"
How to detect when AVPlayer video ends playing?,84,"ios, iphone, swift, avplayer"
How to use Charles Proxy on the Xcode 6 (iOS 8) Simulator?,84,"ios, ios8, xcode6, ios-simulator, charles-proxy"
Creating layout constraints programmatically,84,"objective-c, ios, constraints, autolayout"
Allow only Numbers for UITextField input,84,"ios, ipad, cocoa-touch, uitextfield, uikeyboard"
"Objective C - Assign, Copy, Retain",84,"ios, objective-c, macos, memory-management, attributes"
The Simulator can't be launched because it is already in use,84,"ios, xcode, ios-simulator"
How to integrate Cocoapods with a Swift project?,84,"ios, objective-c, xcode, swift, cocoapods"
resize superview after subviews change dynamically using autolayout,84,"ios, objective-c, uiview, autolayout, autoresize"
Grouped UITableview remove outer separator line,84,"ios, objective-c, uitableview, cell, tableviewcell"
Update badge with push notification while app in background,84,"ios, apple-push-notifications"
How can I write an iPhone app entirely in JavaScript without making it just a web app?,84,"javascript, ios, objective-c"
"What programming languages can one use to develop iPhone, iPod Touch and iPad (iOS) applications?",84,"iphone, ipad, ios4, ios"
Emulate/Simulate iOS in Linux [closed],84,"linux, ios, ubuntu-10.04"
Round two corners in UIView,83,"ios, objective-c, iphone, rounded-corners"
didFailWithError: Error Domain=kCLErrorDomain Code=0 “The operation couldn’t be completed. (kCLErrorDomain error 0.)”,83,"ios, iphone, core-location, cllocationmanager, cllocation"
How to set image in circle in swift,83,"ios, swift, uiimageview"
UICollectionReusableView method not being called,83,"ios, uicollectionview"
Loading an “overlay” when running long tasks in iOS,83,"ios, swift, uiview, overlay"
Convert NSDate to String in iOS Swift [duplicate],83,"ios, swift, swift3, nsdateformatter"
Width and Height Equal to its superView using autolayout programmatically?,83,"ios, swift, dynamic, autolayout, nslayoutconstraint"
UIImageView - How to get the file name of the image assigned?,83,"ios, objective-c, swift, uiimageview, uiimage"
How to split string into substrings on iOS?,83,"ios, objective-c, iphone, string, substring"
Get file size in Swift,83,"ios, swift"
Accidentally removed xcassets file from Xcode project,83,"ios, xcode, xcasset"
can't get correct value of keyboard height in iOS8,83,"ios, objective-c, cocoa-touch, keyboard, ios8"
Framework not found GoogleToolboxForMac,83,"ios, firebase, swift2, cocoapods, google-toolbox-for-mac"
Adding a view controller as a subview in another view controller,83,"ios, swift, uiviewcontroller"
In Xcode I see (no paired Apple Watch) even though the watch is paired and the watch's UDID is registered,83,"ios, iphone, xcode, apple-watch, beta"
How do I add text to an image in iOS Swift?,83,"ios, swift, uiimage"
Swift language NSClassFromString,83,"ios, objective-c, swift"
XCTest/XCTest.h not found on old projects built in Xcode 6,83,"ios, xcode, cocoapods, xctest"
'No such module' when I use CocoaPods,83,"ios, xcode, swift, cocoapods"
Dynamic Height Issue for UITableView Cells (Swift),83,"ios, swift, xcode, uitableview, row-height"
'automaticallyAdjustsScrollViewInsets' was deprecated in iOS 11.0,83,"ios, swift, xcode, deprecated"
How can I test Apple Push Notification Service without an iPhone?,83,"ios, testing, apple-push-notifications, ios-simulator"
dismissModalViewController AND pass data back,83,"iphone, ios, uiviewcontroller, modalviewcontroller"
How to create an “array of selectors”,83,"ios, objective-c, nsarray, selector"
'Framework not found' in Xcode,83,"ios, xcode, xcode6, ios-frameworks"
How to see the javascript errors of PhoneGap app in Xcode?,83,"javascript, ios, xcode, debugging, cordova"
The compiler is unable to type-check this expression swift 4?,83,"ios, swift"
"iOS 7 App Icons, Launch images And Naming Convention While Keeping iOS 6 Icons",83,"ios, xcode, ios7, xcode5"
The bundle UITests couldn’t be loaded because it is damaged or missing necessary resources. Try reinstalling the bundle,83,"ios, swift, travis-ci, uitest"
Why I can't use let in protocol in Swift?,83,"ios, swift, protocols, getter-setter, swift-protocols"
Error itms-90035 - Xcode,83,"ios, xcode, appstore-approval"
com.apple.WebKit.WebContent drops 113 error: Could not find specified service,83,"ios, webkit, wkwebview"
iOS 7 - is there a way to disable the swipe back and forward functionality in Safari?,83,"ios, safari, ios7"
What kind of sarcastic error is this iOS?,83,"ios, objective-c, debugging, nsdateformatter"
Best way to parse URL string to get values for keys?,82,"ios, objective-c, swift, parsing, cocoa-touch"
How to split filename from file extension in Swift?,82,"ios, string, swift"
Underline button text in Swift,82,"ios, xcode, swift"
Change UIButton BorderColor in Storyboard,82,"ios, colors, uibutton, storyboard"
iOS - UIImageView - how to handle UIImage image orientation,82,"ios, uiimageview, uiimage, orientation"
UIGestureRecognizer blocks subview for handling touch events,82,"objective-c, ios, uiview, uigesturerecognizer, uiresponder"
Xamarin.Forms ListView: Set the highlight color of a tapped item,82,"android, ios, listview, xamarin, xamarin.forms"
Limit number of characters in uitextview,82,"ios, iphone, uitextview, uitextviewdelegate"
Xcode 6 process launch failed: timed out trying to launch app,82,"ios, xcode, xcode6"
SwiftUI @Binding Initialize,82,"ios, swift, swiftui, ios13"
Centering subview's X in autolayout throws “not prepared for the constraint”,82,"ios, objective-c, autolayout, nslayoutconstraint, uiview-hierarchy"
AFNetworking Post Request,82,"ios, objective-c, afnetworking, afnetworking-2"
iPhone UITableView. How do turn on the single letter alphabetical list like the Music App?,82,"ios, iphone, objective-c, uitableview"
How do you draw a line programmatically from a view controller?,82,"ios, objective-c, uiview, uikit"
Attempting to load the view of a view controller while it is deallocating… UISearchController,82,"ios, swift, uisearchcontroller"
Circular UIImageView in UITableView without performance hit?,82,"ios, objective-c, uitableview, uiimageview"
modal View controllers - how to display and dismiss,82,"ios, objective-c, uiviewcontroller, presentviewcontroller, dismissviewcontroller"
Check if PHP-page is accessed from an iOS device,82,"php, iphone, ios, http-headers"
Add entry to iOS .plist file via Cordova config.xml,82,"ios, cordova, phonegap-plugins, cordova-3, cordova-plugins"
Show search bar in navigation bar without scrolling on iOS 11,82,"ios, uinavigationitem, uisearchcontroller"
Set rootViewController of UINavigationController by method other than initWithRootViewController,82,"ios, uinavigationcontroller, uitoolbar, iphone-5"
How do I use a UISegmentedControl to switch views?,82,"ios, objective-c, iphone, uisegmentedcontrol"
How to detect tableView cell touched or clicked in swift,82,"ios, swift, uitableview"
NSURLErrorDomain error code -999 in iOS,82,"ios, lua, coronasdk, nsurl, nsurlerrordomain"
How to get the scroll bar with CSS overflow on iOS,82,"css, ipad, ios"
Xcode 5 and iOS 7: Architecture and Valid architectures,82,"iphone, ios, xcode, ios7"
How do I upload a build to iTunes Connect for TestFlight?,82,"ios, xcode, app-store-connect, testflight"
Impossible to hide navigation bars in Safari iOS 7 for iPhone/iPod touch,82,"javascript, ios, html, ios7, safari"
/usr/bin/codesign failed with exit code 1,82,"iphone, ios, xcode, deployment, code-signing"
Google Analytics SDK 3.0 _sqlite3 linker errors in iOS,82,"ios, objective-c, sqlite, google-analytics"
Creating a reusable UIView with xib (and loading from storyboard),82,"ios, objective-c, uiview, storyboard, nib"
Xcode 6.3 freezes/hangs after opening XIB file,82,"ios, xcode, xcode6.3"
NSDictionary with ordered keys,82,"ios, objective-c, cocoa, nsdictionary"
HTML file input control with capture and accept attributes works wrong?,82,"android, ios, html, mobile"
How to connect Android device to an iOS device over BLE (Bluetooth Low Energy),82,"android, ios, bluetooth-lowenergy, core-bluetooth, android-4.3-jelly-bean"
Scale UIButton Animation- Swift [closed],81,"ios, swift, cgaffinetransformscale"
How to create a toast message in Swift?,81,"ios, swift"
How do I resize the UIImage to reduce upload image size,81,"ios, swift, uiimage"
How to add one month to an NSDate?,81,"ios, iphone, objective-c, nsdate"
How do I scale a UIButton's imageView?,81,"ios, uibutton, scale"
Save images in NSUserDefaults?,81,"ios, objective-c, iphone, swift, ipad"
Compare two version strings in Swift,81,"ios, swift"
How to get device width and height?,81,"ios, swift, cocoa-touch, uiscreen, cgsize"
Xcode 4 Error: Error Starting Executable,81,"xcode, ios, launch"
Share data between two or more iPhone applications,81,"iphone, ios, xcode, ipad, ios5"
Can UIView be copied?,81,"ios, objective-c, uiview, copy"
NSOperation and NSOperationQueue working thread vs main thread,81,"ios, objective-c, multithreading, nsoperation, nsoperationqueue"
Changing back button in iOS 7 disables swipe to navigate back,81,"ios, uinavigationcontroller, ios7, uibarbuttonitem, uiviewanimation"
Animate UILabel text between two numbers?,81,"ios, iphone, animation, text, uilabel"
Example of NSAttributedString with two different font sizes?,81,"ios, nsattributedstring"
ARC - The meaning of __unsafe_unretained?,81,"objective-c, ios, macos, xcode4, automatic-ref-counting"
"didReceiveRemoteNotification not called, iOS 10",81,"ios, objective-c, swift3, apple-push-notifications"
NSDictionary Key For Value/Object? [duplicate],81,"objective-c, cocoa-touch, ios, nsdictionary"
Sending SMS in iOS with Swift,81,"ios, swift, iphone, sms, imessage"
Setting up buttons in SKScene,81,"ios, objective-c, uibutton, sprite-kit"
application executable is missing a required architecture armv6,81,ios
How to get enum from raw value in Swift?,81,"ios, swift, enums"
What is the max. value of a double/float on iOS?,81,"ios, c, objective-c, double"
My app was just rejected for using the Ad support framework. Which library is responsible?,81,"ios, parse-platform, appstore-approval, flurry, testflight"
UIStackView : Is it really necessary to call both removeFromSuperView and removeArrangedSubview to remove a subview?,81,"ios, uistackview"
“Could not find Developer Disk Image”,81,"ios, iphone, xcode, xcode7, ios9.1"
"Why do I need @1x, @2x and @3x iOS images?",81,"ios, image, resolution, pixels"
xcode 5.1: libCordova.a architecture problems,81,"ios, xcode, cordova, xcode5.1"
iPhone/iPad browser simulator? [closed],81,"iphone, ios, xcode, ipad, ios-simulator"
Difference between 'YYYY' and 'yyyy' in NSDateFormatter,81,"ios, objective-c, nsdate, nsdateformatter"
Is it possible to debug “Terminated due to memory error”?,81,"ios, objective-c, memory-management, automatic-ref-counting"
"iOS app crashing every other launch, can't find error",81,"ios, xcode, crash, ios-simulator, sigabrt"
Determining if an iPhone is Jail broken Programmatically,81,"iphone, objective-c, ios, cocoa-touch, jailbreak"
Changing tab bar item image and text color iOS,80,"ios, swift, uitabbar, uitabbaritem"
How to enable back/left swipe gesture in UINavigationController after setting leftBarButtonItem?,80,"ios, objective-c, uinavigationcontroller, uinavigationbar, uinavigationitem"
Parse for iOS: Errors when trying to run the app,80,"ios, parse-platform"
Swift UIView background color opacity,80,"ios, swift, uiview, alpha"
How to use presentModalViewController to create a transparent view,80,"ios, iphone, uiviewcontroller"
How to restrict UITextField to take only numbers in Swift?,80,"ios, iphone, swift, ipad, uitextfield"
Programmatically navigate to another view controller/scene,80,"ios, swift, uiviewcontroller, uinavigationcontroller, xcode6"
why UITableViewAutomaticDimension not working?,80,"ios, objective-c, swift, uitableview, row-height"
UIView - How to get notified when the view is loaded?,80,"ios, objective-c, iphone, uiview, viewdidload"
Copy to clipboard using Javascript in iOS,80,"javascript, ios, copy, mobile-safari, clipboard"
presenting ViewController with NavigationViewController swift,80,"ios, swift, uinavigationcontroller, uinavigationbar, viewcontroller"
"What's ALWAYS_EMBED_SWIFT_STANDARD_LIBRARIES with CocoaPods, Swift 3 and Xcode 8",80,"ios, swift3, cocoapods, xcode8"
How do you move a CALayer instantly (without animation),80,"ios, objective-c, cocoa-touch, core-animation, calayer"
How do I get current playing time and total play time in AVPlayer?,80,"ios, avplayer"
How to display activity indicator in middle of the iphone screen?,80,"iphone, ios, ipad"
FBSDKCoreKit/FBSDKCoreKit.h not found error,80,"ios, frameworks"
How to get the name of the running application in iOS,80,"ios, xcode, uiapplication"
Assertion failure when using UISearchDisplayController in UITableViewController,80,"ios, ios6, uitableview, uisearchdisplaycontroller"
How do you check current view controller class in Swift?,80,"ios, swift"
I get an error “None of the input catalogs contained a matching launch image” in xCode5-iOS7,80,"ios, xcode, launchimage"
How to load GIF image in Swift?,80,"ios, swift, uiimageview, uiviewanimation"
setTimeout in React Native,80,"javascript, ios, settimeout, react-native"
How to set a timeout with AFNetworking,80,"objective-c, ios, xcode, networking, afnetworking"
How to animate the background color of a UILabel?,80,"ios, iphone, core-animation"
UIBarButtonItem: target-action not working?,80,"iphone, ios, objective-c, cocoa-touch"
How to generate UUID in ios,80,"ios, objective-c"
Objective-C setting NSDate to current UTC,80,"iphone, objective-c, ios, nsdate, utc"
How can I animate the movement of a view or image along a curved path?,80,"iphone, objective-c, ios, cocoa-touch, core-animation"
Passing arguments to selector in Swift,80,"ios, swift, uikit, selector"
How can I do Key Value Observing and get a KVO callback on a UIView's frame?,80,"iphone, ios, objective-c, uiview, key-value-observing"
What is the strong property attribute,80,"iphone, objective-c, ios, cocoa, macos"
Xcode 6.3 Crashes when navigating from storyboard to other Swift 1.2 file,80,"ios, swift, xcode"
Why am I getting an error “Failed to locate or generate matching signing assets” in Xcode 6?,80,"ios, iphone, xcode6, ios-provisioning"
AVAudioRecorder throws errors,80,"iphone, ios, ios5, avaudiorecorder"
Module 'Alamofire' has no member named 'request',79,"ios, alamofire"
How shouldChangeCharactersInRange works in Swift?,79,"ios, objective-c, swift, uitextfielddelegate, nsrange"
iOS 7 and later: set status bar style per view controller,79,"ios, cocoa-touch"
Analysing Assets.car file in iOS,79,"ios, iphone, ios7, ios6"
UITableView example for Swift,79,"ios, swift, uitableview"
Change the color of a link in an NSMutableAttributedString,79,"ios, iphone, nsattributedstring, nsmutableattributedstring"
How do I draw a circle in iOS Swift?,79,"ios, swift"
Symbol not found: kUTTypeImage,79,"ios, objective-c, linker-errors, mobilecoreservices"
Move or copy view controller from one storyboard to another,79,"ios, xcode, uiviewcontroller, storyboard"
How to change Button Title Alignment in Swift?,79,"ios, swift, uibutton"
UISegmentedControl change number of segments programmatically,79,"ios, uikit, uisegmentedcontrol"
What's the best way to detect when the app is entering the background for my view?,79,"ios, nstimer"
Converting all text to lower case in Objective-C,79,"objective-c, ios, lowercase"
NSURL to file path in test bundle with XCTest,79,"ios, tdd, nsbundle, xctest"
iOS download and save image inside app,79,"iphone, cocoa-touch, ios, ipad"
Any way to bold part of a NSString?,79,"objective-c, ios, nsstring"
file was built for archive which is not the architecture being linked (i386),79,"ios, iphone, xcode, ipad, linker-errors"
Property cannot be found in forward class object,79,"ios, xml, properties, gdataxml"
"Test target X encountered an error (Early unexpected exit, operation never finished bootstrapping - no restart will be attempted",79,"ios, unit-testing, xcode7, ocmock"
Jerky Scrolling After Updating UITableViewCell in place with UITableViewAutomaticDimension,79,"ios, uitableview, swift, ios8"
Xcode 9 : Module compiled with Swift 3.1 cannot be imported in Swift 4.0,79,"ios, cocoapods, facebook-login, xcode9-beta, swift4"
"iOS 10 GM release error when submitting apps “app attempts to access privacy-sensitive data without a usage description” due to GoogleSignIn, AdMob",79,"ios, firebase, admob, google-signin"
Where should I be setting autolayout constraints when creating views programmatically,79,"ios, cocoa-touch, autolayout"
Proper usage of the Alamofire's URLRequestConvertible,79,"ios, swift, alamofire"
UICollectionView flowLayout not wrapping cells correctly,79,"ios, ios6, uicollectionview, uicollectionviewcell"
Why doesn't Xcode 4 create any products?,79,"xcode, ios, xcode4"
Invoke native date picker from web-app on iOS/Android,79,"javascript, iphone, android, ios, html"
how to open particular screen on clicking on push notification for flutter,79,"android, ios, flutter, dart, firebase-cloud-messaging"
iOS equivalent for Android View.GONE visibility mode,79,"iphone, ios, interface-builder, visibility, autolayout"
iOS SDK - Programmatically generate a PDF file,79,"iphone, objective-c, ipad, ios, pdf-generation"
What does Unrestricted Web Access mean in iTunes Connect,79,"ios, uiwebview, app-store-connect, appstore-approval, sfsafariviewcontroller"
screen styling when virtual keyboard is active,79,"javascript, android, css, ios, mobile"
Flutter : How can I add divider between each List Item in my code?,78,"android, ios, flutter"
Indent the text in a UITextField,78,"iphone, objective-c, ios, cocoa-touch, uitextfield"
UITableview reloaddata with animation,78,"ios, uitableview, reloaddata"
UITableView: hide header from empty section,78,"objective-c, ios, uitableview, tableview"
How to identify previous view controller in navigation stack,78,"objective-c, ios, uiviewcontroller, uinavigationcontroller"
How to set iOS status bar background color in React Native?,78,"ios, react-native, ios7-statusbar"
How to write text on image in Objective-C (iOS)?,78,"ios, iphone, uiimageview"
iOS7 UITextView contentsize.height alternative,78,"ios, uitextview, ios7"
dyld: Library not loaded: @rpath/libswiftCore.dylib / Image not found,78,"ios, swift, xcode6"
Info.plist Utility Error: “Info.plist couldn't be opened because there is no such file”,78,"ios, objective-c, xcode, relative-path, info.plist"
AFNetworking 2.0 add headers to GET request,78,"iphone, ios, objective-c, afnetworking, afnetworking-2"
How to remove the last border of the last cell in UITableView?,78,"iphone, objective-c, ios, xcode, uitableview"
Get lighter and darker color variations for a given UIColor,78,"ios, swift, colors, core-graphics, uicolor"
Checking a null value in Objective-C that has been returned from a JSON string,78,"ios, objective-c, json"
How to change uitableview delete button text,78,"iphone, ios, uitableview, delegates"
What happens if my distribution certificate expires?,78,"ios, certificate, app-store, code-signing, certificate-expiry"
How to get UITableViewCell indexPath from the Cell?,78,"iphone, ios, objective-c, xcode, cocoa"
What properties can I set via an UIAppearance proxy?,78,"iphone, ios, ios5, ios6, uikit"
"Overriding method with selector 'touchesBegan:withEvent:' has incompatible type '(NSSet, UIEvent) -> ()'",78,"ios, swift, overriding"
How to clear or clean specific pod from the local cocoapods cache,78,"ios, xcode, cocoapods"
ZIP file content type for HTTP request [duplicate],78,"ios, http, nsurlrequest"
Can I use a UIRefreshControl in a UIScrollView?,78,"ios, iphone, uiscrollview, xamarin.ios, uirefreshcontrol"
How can I prevent the display on an iOS device from dimming and turning off? [duplicate],78,"iphone, ipad, screen, ios"
Using Multiple Storyboards in iOS,78,"ios, user-interface, ios5, xcode4.2, uistoryboard"
iOS autolayout to center my view between two views,78,"ios, interface-builder, autolayout"
Load local html into UIWebView using swift,78,"ios, swift, uiwebview"
IB Designables: Failed to update auto layout status: Failed to load designables from path (null),78,"ios, xcode"
Add rounded corners to all UIImageViews,78,"ios, subclass, code-reuse, objective-c-category"
iOS: How to debug “freshly launching” an app from a URL,78,"ios, xcode, debugging, ios-simulator, openurl"
Present and dismiss modal view controller,78,"ios, objective-c, uiviewcontroller, modal-view"
Could not load the “” image referenced from a nib in the bundle with identifier,78,"ios, iphone"
Auto Layout constraint on CALayer IOS,78,"ios, autolayout, calayer"
Write a file on iOS,78,"ios, iphone, file, nsbundle"
Ignore certain exceptions when using Xcode's All Exceptions breakpoint,78,"iphone, ios, xcode"
What exactly can CoreBluetooth applications do whilst in the background?,78,"ios, core-bluetooth"
How do I locate the CGRect for a substring of text in a UILabel?,78,"ios, ios7, uilabel, textkit"
Invalid iPhone Application Binary,78,"iphone, ios, app-store, code-signing, app-store-connect"
What exactly does `pod repo update` do?,78,"ios, iphone, xcode, cocoapods, podfile"
Debug iOS 6+7 Mobile Safari using the Chrome DevTools,78,"ios, safari, mobile-safari, google-chrome-devtools, web-inspector"
iPhone: What is a WWDR intermediate certificate?,78,"iphone, ios, app-store, provisioning"
How to draw a smooth circle with CAShapeLayer and UIBezierPath?,78,"ios, uikit, core-graphics, calayer, cashapelayer"
"“Do Not Embed”, “Embed & Sign”, “Embed Without Signing”. What are they?. What they do?",78,"ios, frameworks, code-signing, xcode11, ios-app-extension"
Tool to convert from Swift to objective-c [closed],78,"ios, objective-c, swift"
Why is a Safari page breaking iOS rendering?,78,"javascript, ios, iphone, safari, artifacts"
CoreData + iCloud + Cascade Delete - how to handle?,78,"ios, core-data, icloud, cascading-deletes"
"Swift - check if a timestamp is yesterday, today, tomorrow, or X days ago",77,"ios, swift, nsdate, nscalendar"
UINavigationBar - Set title programmatically?,77,"ios, iphone, xcode4, uinavigationbar"
Swift ios check if remote push notifications are enabled in ios9 and ios10,77,"ios, swift, xcode, push-notification"
iOS 7 Translucent Modal View Controller,77,"ios, objective-c, uinavigationcontroller, ios7, presentmodalviewcontroller"
Is there a way to get all values in NSUserDefaults? [duplicate],77,"iphone, ios, objective-c, ios6, nsuserdefaults"
Swift: How to refresh UICollectionView layout after rotation of the device,77,"ios, swift, uicollectionview, flowlayout"
Xcode / iOS simulator: Trigger significant location change manually,77,"iphone, ios, core-location, cllocationmanager"
WKWebView causes my view controller to leak,77,"ios, memory-leaks, webkit, ios8, wkwebview"
Closing a view displayed via a modal segue,77,"objective-c, ios, cocoa-touch, uistoryboard"
Storyboard Segue From View Controller to Itself,77,"ios, uitableview, uiviewcontroller, storyboard, segue"
How To Get Selected Value From UIPickerView,77,"ios, objective-c, cocoa-touch"
Command /Xcode.app/Contents/Developer/Toolchains/XcodeDefault.xctoolchain/usr/bin/clang failed with exit code 1,77,"iphone, objective-c, ios, ipad"
Xcode 4.2 how include one project into another one?,77,"ios, version-control, xcode4.2"
"iOS: what's the fastest, most performant way to make a screenshot programmatically?",77,"ios, performance, core-graphics, graphicscontext, quartz-core"
Xcode 10.2 Failed to Run App on Simulator with iOS < 10,77,"ios, xcode, dyld, xcode10.2"
How to import own classes from your own project into a Playground,77,"ios, swift, swift-playground"
iPhone ad hoc build using Xcode 4,77,"ios, xcode4, adhoc"
Proper Realm usage patterns/best practices?,77,"ios, swift, realm"
is there any way to distribute ios applications outside app store?,77,"ios, iphone, ipad, app-distribution"
IOS simulator slow with Mavericks,77,"ios, xcode, ios-simulator, osx-mavericks"
